Cluster_ID,PageID,Heading,SubHeading,BodyText
JD-SD,MB_07,Market transformations,,"Around 100 years back most of the craftsmen wove the durries and kept them at their homes as the business happened from homes. The customers belonged to different communities residing in the region. These communities included the Rabaris, the Rajputs, the Chaudaris, the Jats, and many others. It is said that the Rabaris who belong to the pastoralists community came to the weavers with handspun yarn and got their durries weaved from them and paid them the weaving charges. Today these local communities however do not wish to buy and use durries. So the demand in local markets of  Salawas or Jodhpur is less and limited and caters to only the tourist or people who are aware of this craft and interested in buying handmade handwoven durries. 
The craftsmen however realized that the demand for handmade crafts is more in the markets outside, so they started selling the durries and other products in exhibitions and other markets. The craftsmen also export the durries to different countries. Today they are associated with different organizations like Banglanatak dot com, and UNESCO which help them propagate their business. They also look forward to expanding online markets and adopting digital technology in different ways to expand their business.
"
JD-SD,MB_08,Involvement of women,,"Most of the weavers in Salawas worked as family units, without any gender distinction in work. This included women of all ages to be a part of the process. Even today, several artisans are working together with their mothers, from whom they had learnt the craft initially. The younger women of the house are important point of contacts for making small balls of yarns that are ultimately used in the weft. The next generation females including the grand-daughters in a few families have been keenly learning the craft along with pursuing their education. These women have steerheaded the business, and kept the craft alive even in times when the men went out of their way to find alternative income sources. It is through them that the oral traditionals and mechanical knowledge has passed down from generation to generation.
"
JD-SD,MB_09,Washing the durry,,"The prepared durrys are sent to the washing line post the final check. It is however not an essential requirement for their sale. But in case of consumer demand, the durrys are washed in an open space with plain water and brushed over. In few cases a strong stone wash technique is applied on them. It is ideally done to straighten the threads of the freshly made durry and remove any external dust accumulated during the process of weaving, as the loom is generally set in an open space.
"
JD-SD,MB_10,Use of charkha,,"While most of the artisans today prefer purchasing the dyed yarn directly from large scale manufacturers, there are a few artisans like Malaram Mundel Ji, who still believes in making his own yarn from fibre. Using the age old tradition of weaving on a charkha, Malaram Ji and his son together have revived the process their forefathers used. Following this practice, they not just reduce their production costs and dependencies, but also increase their credibility of authenticity. 
"
JD-TD,MB_01,Designing techniques,,"Tie and dye involves many steps that helps in achieving a vibrant and colorful pattern on the fabric along with the basic and unavoidable step of tying the fabric in different ways and then dyeing them in varied colorful dye baths.The fabrics used range from cotton, silk, georgette, chiffon, and other synthetic fabrics depending on the customer demand and the final use. For making Bandhani/ Bandhej products these fabrics first get the desired design stamped on it (a process called chapai), then according the designs the knots are pinched and tied, further ready to be washed in clean water and then dyed, submerged and redyed in the colored water.
While Leheriya involves the twisting,folding and tying of fabric in a particular way to achieve horizontal, vertical, diagonal or criss cross lined pattern on the fabrics
"
JD-TD,MB_02,Communities involved,,"Tie and dye has been associated with different communities that not only practise this craft but also people who use the products made from this craft process. Rangrez, Chhipa, Chadua, and Neelgar communities are involved in the making process of the Bandhej products. While we also find a social and cultural association with the motifs and pattern on the clothes designed. 
These designs were customised separately for different people, were identity markers for some and passed their own stories down too. Chundaris now popular as dupattas with green boxes were worn only by the Rajputs. Meanwhile  there was a five colored turban called a panchranga safa was exclusively worn by the Champawat Rajputs, while today we see almost everyone wearing it on special occasions. These stories and utility of the customised designed bandhej products from the past remain with the older generation people of the craft community, in museums and or documented in books,vidoes or pictures with a welcoming approach to new designs, new stories and new uses of the craft.
"
JD-TD,MB_03,Participation of women,,"The women from the communities who are associated with tie and dye craft have been a part of the craft process in some or the other way. The women from the Jodhpur tie and dye craft cluster are mostly involved in the tying process of the fabric preceding the dyeing of the fabric. 
The women mostly work from home so they have the fabric with preparation delivered at home and after they finish the tying process it is sent to the workshops for dyeing. At some well to do households of the craft cluster the women look after the house and do not participate in business. 

"
JD-TD,MB_04,Fierce competition,,"Every craft faces challenges along its journey of growth and evolution. Tie and dye as a craft has been and is going through some ups and downs. Handmade craft and textile have a special recognition and demand in the markets, specially the markets outside India. The craftsmen in Jodhpur are now well aware about the same and slowly wish to fulfill needs of the market. 
Mohd. Tasleem, one of the craftsmen hence says, ‘We know that there is always going to be ample demand for the craft, however today we have more and more people who are practising this craft hence there is a competition among us’. So we see that there are migrants who are learning about the craft and starting their businesses thus creating a more competitive market which reduces the wages that the craftsmen get. Because of which chance of using cheaper raw material which give cheaper final products is seen. There is a wave of use of synthetic fabrics and chemical dyes in the market which may be harmful for in the long run.
"
JD-TD,MB_05,Learning within the community,,"The role as a community is very significant in most of the living heritages, craftsmanship being one. The Rangrez, Chauda, Chippa and the Neelgar communities have been working together for several generations to keep the craft of tie and dye in practise till day.  
The production process of tie and dye involves multiple steps and techniques. Earlier particular community specialised in a particular technique and only they use to do that part of the process further passing to the next community. For example, the Vankars(weavers) would weave the fabric followed by the Rangrez or Chauda community who would either buy this weaved fabric for dyeing or would dye the yarn used for weaving and share with the weavers. The fabric was washed, cleaned, stamped, tied and dyed and sold in markets further to other community people. If the fabric was to be dyed in shades on Indigo the Neelgars used to buy the fabric and work with it.  While today each and every community performs all steps as they have more number of people who are working and they wish to be self sufficient in the business. While doing this too there is an exchange between the communities about the new products to be used, raw material, processes and also the difficulties they face.
"
JD-TD,MB_06,Shift in market,,"Change is the only constant. Appropriately seen as the crafts of Jodhpur adapt and grow with times. The emphasis on the fact that how the local communities of Rajasthan from the royals to the commoners have been using tie and dyed products has already been discussed earlier. The use from day to day wear has also seen a shift to specific festival or celebrations. 
The customers today are dominantly people from outside the state of Rajasthan including tourists, people who love and admire handmade crafts and people who reside outside India as the craft products are being exported to places. Younger generation of the craftsmen is educated and has more exposure with technology so they are also catering to large audience not only through the local markets but also by selling in fairs, exhibitions, global markets and online platforms. Since the people come from various demographics the craftsmen have also made a change in their approach and they have started producing products in a huge variety. 
"
JD-TD,MB_07,Product Diversification,,"We have evidently seen how the chundaris(duppatas), turbans, sarees, lehengas and blouses were the dominant products in the markets over the many generations. These were the traditional outfits of the people from Rajasthan and hence the craftsmen of the tie and dye community also mostly produced them in bulk.
Today we see a shift in the approach, along with these traditional outfits there are a range of products from dupattas, stoles, scarfs, bandanas, single and double bedsheets, pillows, sarees, suits, tops, dresses and many more. The younger generation in the craftsmen community is educated and we also see many craftsmen becoming designers so they understand the market better and help bringing more suggestions to the table further expanding the family legacy and craftsmanship in multiple directions.
"
JD-TD,MB_08,Legacies and beyond,,"You would find very rare craft practices that do not have their stories and association of the legacies of how the craftsmen have acquired the skills and knowledge from their ancestors over the years. And a famous tag line that Indian craftsmen love to say “Peedihyo se chale aa raha hai”, the craft has been practised from several generations in our family.
Tie and dye in Jodhpur has been here for almost more than 5000 years and still continues to prosper as the community practices the craft with love and passion while making their livelihood turning them into businesses. Each and every craftsman joyfully narrates with pride how they have been trained by their grandparents, parents, or relatives and how today they share their legacy with their family and continue pratcising the craft.

"
JD-TD,MB_09,Evolution of process,,"The shift from 100 % manual processes to adapting to partial technology for making these exclusive hand made pieces has been visible in the tie and dye craft processes. In today’s times where the craftsmen are looking to scale up their businesses it becomes very important to adapt to technology while keeping in mind that the authentic processes are not interferred with. 
The craftsmen of Jodhpur have incorporated some machines to speed the process of the craft. Like we see that there are drying machines used to dry large stock of clothes in one go. There is a distinct growth seen as we see the craftsmen talking about dyeing in bulk, dyeing almost 400 pieces of duppatta in one go ot 100 sarees at a time. 
"
JD-TD,MB_10,Handmade will stay,,"Each and every handmade product is unique and always owns a reflection of the identity of the artisan who makes it. The disticnt identity of the product gives has a sentimental value attached to it which is felt by the maker and user . It has its own journey and story which makes it one of a kind in your collection.
The craftsmen in Rajasthan who make tie and dye so confidentiality say that even though you may get thousands of look alike products like tie and dye effect we will keep making them because handmade finish and feel cannot be replaced by machines.
The market in Jodhpur and other parts of Rajasthan has wide change of machine made polyester  based products which attract the shooppers due to its cheap rates but the handmade market is in equal demand. With more global awareness about importance of handmade, sustainable products the demand is slowly rising and we also see the craftsmen gaing more confidence of continuing their heritage practices.
"